OrgSpringRank,OrgID,OrgLocationCountry,OrgLocationDetails,OrgName,OrgType
2.272330838361475,https://ror.org/02h1mqb03,KZ,Almaty,Kazakh Institute of Oncology and Radiology,facility
1.8113370441113306,https://ror.org/04nj3w743,KZ,Almaty,German Kazakh University,education
1.8113370441113306,https://ror.org/04qer5752,KZ,Almaty,Institute of Archaeology named after A.Kh.Margulan,facility
1.2722146182981204,https://ror.org/05pc6w891,KZ,Almaty,Kazakh National Medical University,education
1.011734221698735,https://ror.org/033cvvt68,KZ,Almaty,Kazakh National Agrarian Research University,education
0.9788813974626763,https://ror.org/03pscpn55,KZ,Almaty,Kazakh Academy of Transport and Communications named after M.Tynyshpaev,education
0.955752503493792,https://ror.org/05eq5hr59,KZ,Taldıqorğan,Zhetysu University named after Ilyas Zhansugurov,education
0.8808752669004689,https://ror.org/02szhdk88,KZ,Almaty,Kazakh University Ways of Communications,education
0.860150648022488,https://ror.org/02bvvhn54,KZ,Almaty,Abai Kazakh National Pedagogical University,education
0.8113256945100731,https://ror.org/03q0vrn42,KZ,Almaty,Al-Farabi Kazakh National University,education
0.811325573586053,https://ror.org/01rwphz66,KZ,Almaty,National Academy of Sciences of the Republic of Kazakhstan,facility
0.8013138855374383,https://ror.org/03kg5qh91,KZ,Semey,Semey Medical University,education
0.6513904568241806,https://ror.org/014kyp779,KZ,Taraz,M. Kh Dulati Taraz State University,education
0.5800870082087358,https://ror.org/0242cby63,KZ,Nur-Sultan,L. N. Gumilyov Eurasian National University,education
0.5173507129196164,https://ror.org/052bx8q98,KZ,Nur-Sultan,Nazarbayev University,education
0.3722652152339789,https://ror.org/01rn0fp76,KZ,Almaty,Kazakh-British Technical University,education
0.3424943226528606,https://ror.org/045mxyc94,KZ,Almaty,Turan University,education
0.32506067504589814,https://ror.org/01rvqzw67,KZ,Almaty,University of International Business,education
0.31919497295931054,https://ror.org/03gvsr558,KZ,Nur-Sultan,KAZGUU University,education
0.30475813447801037,https://ror.org/05vzasa79,KZ,Almaty,Kurmangazy Kazakh National Conservatory,education
0.27236829055115225,https://ror.org/02z23mj13,KZ,Almaty,Kazakh Eye Research Institute,healthcare
0.2626551076261573,https://ror.org/02q35ve03,KZ,Almaty,Kazakh Ablai Khan University of International Relations and World Languages,education
0.21942940828430516,https://ror.org/01mgaqp12,KZ,Aktobe,Aktobe Regional State University named after K.Zhubanov,education
0.2129430550949869,https://ror.org/025hwk980,KZ,Shymkent,South Kazakhstan Medical Academy,education
0.2090555084211509,https://ror.org/05xx3wf87,KZ,Almaty,Institute of Mathematics and Mathematical Modeling,government
0.20682452704952622,https://ror.org/038mavt60,KZ,Nur-Sultan,Astana Medical University,education
0.1598091196736501,https://ror.org/024cz2s53,KZ,Karaganda,Karaganda Medical University,education
0.14722516219431492,https://ror.org/00kc94n51,KZ,Almaty,Kazakh National Women's Teacher Training University,education
0.13240371119700964,https://ror.org/02zr5p933,KZ,Temirtau,Karaganda State Industrial University,education
0.12952517615333875,https://ror.org/00zgt9663,KZ,Semey,Alikhan Bokeikhan University,education
0.08369822041039901,https://ror.org/00rhgqg04,KZ,Almaty,Almaty Management University,education
0.07702828000554597,https://ror.org/020cpsb96,KZ,Almaty,Satbayev University,education
0.037498850568385436,https://ror.org/00vj0q898,KZ,Ust-Kamenogorsk,Sarsen Amanzholov East Kazakhstan University,education
0.011701277634963697,https://ror.org/05nmhtv58,KZ,Atyrau,Atyrau State University named of Kh.Dosmukhamedova,education
0.010191714464513158,https://ror.org/00cae8n39,KZ,Aktau,Yessenov University,education
0.0,https://ror.org/0033gxm08,KZ,Oral,Mahambet Otemiusly West Kazakhstan University,education
0.0,https://ror.org/028m4pg81,KZ,Almaty,Kazakh Scientific Research Veterinary Institute,facility
0.0,https://ror.org/04ehpm154,KZ,Aktobe,West Kazakhstan Marat Ospanov State Medical University,education
-0.05921313607078907,https://ror.org/024j7nb58,KZ,Pavlodar,Pavlodar State Pedagogical University,education
-0.06401920014550853,https://ror.org/01pk2ck74,KZ,Almaty,KIMEP University,education
-0.09209994193244102,https://ror.org/00eq8hh49,KZ,Karagandy,Karagandy State University,education
-0.11627083743015709,https://ror.org/05y74m987,KZ,Kostanay,Kostanay State University A Baitursynov,education
-0.11929107953978926,https://ror.org/020d95911,KZ,Almaty,Almaty University of Power Engineering and Telecommunications,education
-0.12633396904534233,https://ror.org/0523w7v09,KZ,Almaty,Narxoz University,education
-0.13987396244368883,https://ror.org/00j4d3v37,KZ,Nur-Sultan,Eurasian Humanities Institute,education
-0.13987396244368883,https://ror.org/02shbjh24,KZ,Almaty,Kazakh Research Institute of Plant Protection and Quarantine,facility
-0.13987396244368883,https://ror.org/04bwss030,KZ,Zhezqazghan,Zhezkazgan Baikonurov University,education
-0.13987396244368883,https://ror.org/05jra0838,KZ,Almaty,T.K. Zhurgenov Kazakh National Academy of Arts,education
-0.14708167844801442,https://ror.org/042dtza69,KZ,Almaty,International Information Technologies University,education
-0.17239953423987178,https://ror.org/01gtvs751,KZ,Turkestan,Ahmet Yesevi University,education
-0.188625503698992,https://ror.org/02avqnk51,KZ,Almaty,Kazakh Academy of Sport and Tourism,education
-0.188625503698992,https://ror.org/02f0t3e51,KZ,Almaty,National Center of Space Research and Technology,government
-0.18867421859172503,https://ror.org/03pj6ge82,KZ,Nur-Sultan,Ministry of Education and Science of the Republic of Kazakhstan,government
-0.19892681394924047,https://ror.org/022syee28,KZ,Nur-Sultan,Ministry of Health of the Republic of Kazakhstan,government
-0.19892681394924047,https://ror.org/05d2zbe90,KZ,Nur-Sultan,National Research Center for Maternal and Child Health,healthcare
-0.20323681770151647,https://ror.org/052q3p191,KZ,Semey,Shakarim State University Of Semey,education
-0.2108859464482265,https://ror.org/01xeb1c73,KZ,Almaty,Almaty Technological University,education
-0.27206270869384297,https://ror.org/0336rcx12,KZ,Kyzylorda,Korkyt Ata Kyzylorda State University,education
-0.2795708926524139,https://ror.org/017wmdt28,KZ,Pavlodar,S. Toraighyrov Pavlodar State University,education
-0.3042944520091205,https://ror.org/00xhcc696,KZ,Nur-Sultan,National Center for Biotechnology,facility
-0.3075264022438621,https://ror.org/02cbftw37,KZ,Karaganda,Private Institution “Karaganda University of Kazpotrebsoyuz”,education
-0.3327252467077301,https://ror.org/02xbhbx68,KZ,Ust-Kamenogorsk,D. Serikbayev East Kazakhstan State Technical University,education
-0.34860907113308043,https://ror.org/024etxn40,KZ,Nur-Sultan,S.Seifullin Kazakh Agro Technical University,education
-0.3932100852269664,https://ror.org/02s8x5a25,KZ,Almaty,Suleyman Demirel University,education
-0.4826525844979782,https://ror.org/03h8f2y52,KZ,Oral,Agrarian-Technical University,education
-0.4887116315810323,https://ror.org/03x368n87,KZ,Karagandy,Karaganda State Technical University,education
-0.5645586019798908,https://ror.org/0417k2898,KZ,Pavlodar,Innovative University of Eurasia,education
-0.5795913122549401,https://ror.org/04rtxcq25,KZ,Arkalyk,Arkalyk State Pedagogical Institute named after Ibrai Altynsarin,education
-0.6268844458489401,https://ror.org/00e4pwa85,KZ,Rudnyy,Rudny Industrial Institute,education
-0.7508832127493117,https://ror.org/05xzaq362,KZ,Shymkent,M.Auezov South Kazakhstan State University,education
-0.8323604462111035,https://ror.org/026mr5885,KZ,Nur-Sultan,Republican Center for Healthcare Development,healthcare
-0.9229713598826009,https://ror.org/05czq7m38,KZ,Almaty,Caspian University,education
-1.0920546636686361,https://ror.org/054r9x893,KZ,Nur-Sultan,Kazakh University of Technology and Business,education
-1.1053986623257646,https://ror.org/0352wb750,KZ,Petropavl,Manash Kozybayev North Kazakhstan University,education
-1.1470850462269304,https://ror.org/03v6e0k54,KZ,Almaty,Institute of Information and Computational Technologies,facility
-1.211048929735438,https://ror.org/03gk5bm92,KZ,Ust-Kamenogorsk,Kazakh-American Free University,education
-1.3932284673341164,https://ror.org/04qw17677,KZ,Kostanay,Kostanai State Pedagogical University,education
-1.4887836981243578,https://ror.org/02k3grx88,KZ,Nur-Sultan,KazMunayGas (Kazakhstan),company
-2.1052188779932672,https://ror.org/04xy7xh64,KZ,Almaty,Academy of Civil Aviation,education
