OrgSpringRank,OrgID,OrgLocationCountry,OrgLocationDetails,OrgName,OrgType
1.7144939960259293,https://ror.org/03r56rv89,ZA,Durban,King Edward VIII Hospital,healthcare
1.5501368640327342,https://ror.org/05rgme147,ZA,Cape Town,FitzPatrick Institute of African Ornithology,nonprofit
1.5442617310145585,https://ror.org/01fsqt491,ZA,Modderfontein,Da Vinci Institute,education
0.9008866478748744,https://ror.org/02j01mp63,ZA,Pretoria,National Metrology Institute of South Africa,facility
0.8755179064847484,https://ror.org/03p74gp79,ZA,Rondebosch,University of Cape Town,education
0.8721710976434164,https://ror.org/00dxccz84,ZA,Middelburg,Mpumalanga Deparment of Health,government
0.8320910519787504,https://ror.org/056jc8s48,ZA,Durban,Regent Business School,education
0.8220966539424889,https://ror.org/05bh7ap46,ZA,Durban,Management College of Southern Africa,education
0.7939270028217029,https://ror.org/04qzfn040,ZA,Durban,University of KwaZulu-Natal,education
0.7142341122367224,https://ror.org/03rp50x72,ZA,Johannesburg,University of the Witwatersrand,education
0.708711263172808,https://ror.org/05bk57929,ZA,Stellenbosch,Stellenbosch University,education
0.6589297982256467,https://ror.org/030ajjm26,ZA,Johannesburg,Absa Bank (South Africa),company
0.6290434885365205,https://ror.org/00g0p6g84,ZA,Pretoria,University of Pretoria,education
0.6231499307420348,https://ror.org/03wb61205,ZA,Johannesburg,Sappi (South Africa),company
0.5924619081274455,https://ror.org/00h2vm590,ZA,Cape Town,University of the Western Cape,education
0.5618745262208167,https://ror.org/02nys7898,ZA,Cape Town,Western Cape Department of Health,government
0.5598964158000556,https://ror.org/05b210c34,ZA,Cape Town,City of Cape Town,government
0.5327531824286712,https://ror.org/010f1sq29,ZA,Potchefstroom,North-West University,education
0.5287309911419253,https://ror.org/016sewp10,ZA,Grahamstown,Rhodes University,education
0.4188022874396214,https://ror.org/009xwd568,ZA,Bloemfontein,University of the Free State,education
0.3906743792604524,https://ror.org/02f9k5d27,ZA,Cape Town,African Institute for Mathematical Sciences,education
0.3792042712823637,https://ror.org/0398jd975,ZA,Johannesburg,IMM Graduate School of Marketing,education
0.37430946813906857,https://ror.org/04a711r87,ZA,Pretoria,South African Nuclear Energy Corporation (South Africa),company
0.37302995845237963,https://ror.org/03r1jm528,ZA,Port Elizabeth,Nelson Mandela University,education
0.3305626002745687,https://ror.org/04z6c2n17,ZA,Johannesburg,University of Johannesburg,education
0.3227259757625792,https://ror.org/0047q0d34,ZA,Johannesburg,South African Theological Seminary,education
0.3204329350768131,https://ror.org/01g1ykj19,ZA,Durban,eThekwini Municipality,government
0.3179108980812226,https://ror.org/048cwvf49,ZA,Pretoria,University of South Africa,education
0.28632369494199494,https://ror.org/033z08192,ZA,Bloemfontein,Central University of Technology,education
0.2744708734892048,https://ror.org/04m8jz025,ZA,Durban,South African Sugar Association,other
0.23980126273128116,https://ror.org/0184vwv17,ZA,Alice,University of Fort Hare,education
0.22202770625629095,https://ror.org/05hsgxf19,ZA,Claremont,Milpark Education,education
0.18313563160857932,https://ror.org/01gwm7a05,ZA,Pretoria,Government of South Africa,government
0.11514455602153459,https://ror.org/037zdfv74,ZA,Johannesburg,Lyceum College,education
0.08898052273096131,https://ror.org/03v8ter60,ZA,Empangeni,University of Zululand,education
0.06063145949133523,https://ror.org/037mrss42,ZA,Pretoria,Tshwane University of Technology,education
0.057408923664691296,https://ror.org/056e9h402,ZA,Cape Town,Cape Peninsula University of Technology,education
0.01671800791041525,https://ror.org/0303y7a51,ZA,Durban,Durban University of Technology,education
0.00191902428904395,https://ror.org/003hsr719,ZA,Pretoria,Sefako Makgatho Health Sciences University,education
-0.04284316071427163,https://ror.org/038cnrz59,ZA,Johannesburg,The Independent Institute of Education,education
-0.07963092592206968,https://ror.org/05s0g1g46,ZA,Pretoria,National Research Foundation,nonprofit
-0.08754051748664061,https://ror.org/0338xea48,ZA,Thohoyandou,University of Venda,education
-0.09425384663586273,https://ror.org/05ey7mm31,ZA,Vanderbijlpark,Vaal University of Technology,education
-0.1190360869200777,https://ror.org/05j00sr48,ZA,Pretoria,Council for Scientific and Industrial Research,government
-0.12429428694328136,https://ror.org/02asra118,ZA,Cape Town,Desmond Tutu HIV Foundation,nonprofit
-0.12429428694328136,https://ror.org/02bkvx667,ZA,Cape Town,Research ICT Africa,nonprofit
-0.12429428694328136,https://ror.org/04kzeme37,ZA,Krugersdorp,Hartebeesthoek Radio Astronomy Observatory,facility
-0.12429428694328136,https://ror.org/04m83yd87,ZA,Newlands,Sports Science Institute of South Africa,other
-0.12429428694328136,https://ror.org/04nmx3106,ZA,Johannesburg,AngloGold Ashanti (South Africa),company
-0.12429428694328136,https://ror.org/05s9qrg03,ZA,Cape Town,Equal Education,other
-0.12668134228793,https://ror.org/02jcef994,ZA,Cape Town,South African Tuberculosis Vaccine Initiative,healthcare
-0.1349680415628896,https://ror.org/05q60vz69,ZA,Cape Town,South African Medical Research Council,other
-0.20581435932291092,https://ror.org/02bxpm650,ZA,Johannesburg,South African Institute of International Affairs,facility
-0.20581435932291092,https://ror.org/05hq0zw41,ZA,Illovo,The Oppenheimer Memorial Trust,nonprofit
-0.20601172123113934,https://ror.org/04qkg4668,ZA,Durban,Centre for the AIDS Programme of Research in South Africa,other
-0.22302600162266423,https://ror.org/056206b04,ZA,Pretoria,Human Sciences Research Council,nonprofit
-0.2322826056590179,https://ror.org/017p87168,ZA,Polokwane,University of Limpopo,education
-0.23472219294481747,https://ror.org/00znvbk37,ZA,Johannesburg,National Health Laboratory Service,government
-0.23864960082430453,https://ror.org/02a4gss26,ZA,Johannesburg,Sasol (South Africa),company
-0.2485020115209857,https://ror.org/01jgv6w72,ZA,Johannesburg,National Institute for Theoretical Physics,facility
-0.27709970957306396,https://ror.org/005r3tp02,ZA,Pretoria,South African National Biodiversity Institute,facility
-0.2854360057348561,https://ror.org/005bfja03,ZA,Johannesburg,Regenesys Business School,education
-0.2854360057348561,https://ror.org/00fd6f737,ZA,Pretoria,Institute for Security Studies,education
-0.2854360057348561,https://ror.org/01dak5k93,ZA,Johannesburg,Lancet Laboratories,facility
-0.2854360057348561,https://ror.org/037gpje79,ZA,Rondebosch,Colleges of Medicine of South Africa,education
-0.2854360057348561,https://ror.org/039wwq736,ZA,Johannesburg,Public Affairs Research Institute,facility
-0.2854360057348561,https://ror.org/03ac3bx22,ZA,Pretoria,South African Reserve Bank,other
-0.2854360057348561,https://ror.org/047x96110,ZA,Johannesburg,Johannesburg Hospital,healthcare
-0.2854360057348561,https://ror.org/04j6b9h44,ZA,Pretoria,Foundation for Professional Development,nonprofit
-0.2883111637656295,https://ror.org/049faq822,ZA,Pietermaritzburg,Institute of Natural Resources,nonprofit
-0.29096118334069626,https://ror.org/04c525d12,ZA,Nelspruit,Citrus Research International,facility
-0.2910874023789076,https://ror.org/00xtpbs68,ZA,Cape Town,Claude Leon Foundation,nonprofit
-0.29767757084725616,https://ror.org/00wdk8w52,ZA,Durban,South African Association for Marine Biological Research,other
-0.317762279732499,https://ror.org/02hkfs074,ZA,Cape Town,Helderberg College,education
-0.3217633385041538,https://ror.org/007wwmx82,ZA,Johannesburg,National Institute for Communicable Diseases,government
-0.3240894930462818,https://ror.org/02svzjn28,ZA,Mthatha,Walter Sisulu University,education
-0.3310570818147964,https://ror.org/04r1s2546,ZA,Pretoria,Agricultural Research Council of South Africa,government
-0.3366170381968896,https://ror.org/0400yw722,ZA,Johannesburg,South African College of Applied Psychology,education
-0.3434160075201693,https://ror.org/03q1ded50,ZA,Midrand,Midrand Graduate Institute,education
-0.3705581095698472,https://ror.org/004yh2r83,ZA,Pretoria,Inqaba Biotechnical Industries,company
-0.3705581095698472,https://ror.org/02bkp9390,ZA,Pretoria,South African Veterinary Foundation,nonprofit
-0.3707057068681953,https://ror.org/016x6xx47,ZA,Johannesburg,Baptist Theological College of Southern Africa,education
-0.3707057068681953,https://ror.org/038xyrg49,ZA,Cape Town,Africagrowth Institute (South Africa),company
-0.39226937222990843,https://ror.org/03x9hh156,ZA,Pretoria,Council for Geoscience,government
-0.3979191107758956,https://ror.org/05snt2t16,ZA,Johannesburg,Mintek,facility
-0.3992758431793548,https://ror.org/01kn7bc28,ZA,Kimberley,Sol Plaatje University,education
-0.41053465498021585,https://ror.org/054r97095,ZA,Durban,Mangosuthu University of Technology,education
-0.4332006600654832,https://ror.org/01scpqc23,ZA,Johannesburg,Mapungubwe Institute for Strategic Reflection,facility
-0.4364112587939711,https://ror.org/02vxcq142,ZA,Nelspruit,University of Mpumalanga,education
-0.4374707517169812,https://ror.org/048s34f25,ZA,Pietermaritzburg,Umgeni Water Amanzi,government
-0.43867877178581177,https://ror.org/004n9g494,ZA,Cape Town,Task Applied Science,healthcare
-0.4788872255660196,https://ror.org/01agq7t95,ZA,Pretoria,Open Window School of Visual Communication,education
-0.4828177650153476,https://ror.org/02qv02186,ZA,Pretoria,Water Research Commission,government
-0.5806121330387443,https://ror.org/01748j177,ZA,Pretoria,Collaborative Africa Budget Reform Initiative,other
-0.5806121330387443,https://ror.org/04hzm4679,ZA,Johannesburg,National Institute for Occupational Health,healthcare
-0.5806121330387443,https://ror.org/04wtd6086,ZA,Johannesburg,Development Bank of Southern Africa,other
-0.6469913001660405,https://ror.org/01kde9c12,ZA,Pretoria,Council on Higher Education,government
-0.6687742326698561,https://ror.org/02rhsjm93,ZA,Johannesburg,South African Institute for Distance Education,nonprofit
-0.6687742326698561,https://ror.org/04ah4mt57,ZA,Cape Town,South African School of Motion Picture Medium and Live Performance,education
-0.6687742326698561,https://ror.org/05sar2b82,ZA,Cape Town,Research Research (South Africa),company
-0.6687742326698561,https://ror.org/05vkc3y92,ZA,Johannesburg,Omnia (South Africa),company
-0.681436735938745,https://ror.org/013ysep90,ZA,Cape Town,Isandla Institute,other
-0.750763624434781,https://ror.org/01tcy5w98,ZA,Johannesburg,Aurum Institute,nonprofit
