OrgSpringRank,OrgID,OrgLocationCountry,OrgLocationDetails,OrgName,OrgType
1.8203550739706351,https://ror.org/03c824k52,UZ,Samarkand,Samarkand State Medical Institute,healthcare
0.8203506566300925,https://ror.org/05s259e10,UZ,Tashkent,Tashkent Pediatric Medical Institute,healthcare
0.580225797528053,https://ror.org/05sgw3s08,UZ,Tashkent,Tashkent Medical Academy,education
0.1939079335455872,https://ror.org/011647w73,UZ,Tashkent,National University of Uzbekistan,education
0.08632131085049953,https://ror.org/01kt71615,UZ,Tashkent,Tashkent Institute of Textile and Light Industry,education
0.04845247456660517,https://ror.org/01mk88r89,UZ,Jizzakh,Jizzakh branch of the National University of Uzbekistan named after Mirzo Ulugbek,education
0.03154869595164096,https://ror.org/00phht511,UZ,Tashkent,Tashkent Institute of Architecture and Construction,education
0.03144117139309397,https://ror.org/01s4mx151,UZ,Tashkent,Tashkent Institute of Irrigation and Agricultural Mechanization Engineers,education
1.4070308165130057e-06,https://ror.org/00ae65a65,UZ,Samarkand,Samarkand Institute of Economics and Service,education
0.0,https://ror.org/00swkht58,UZ,Bukhara,Bukhara State Medical Institute,healthcare
0.0,https://ror.org/00x6wnm78,UZ,Tashkent,Central Asian University,education
0.0,https://ror.org/02etsyv71,UZ,Tashkent,Russian Economic University after G.V. Plekhanov,education
0.0,https://ror.org/03tqe1x88,UZ,Andijon,Andijan Institute of Agricultural,education
-0.0038768923586391738,https://ror.org/045qcpw44,UZ,Tashkent,Tashkent Chemical-Technological Institute,education
-0.0354261719308031,https://ror.org/01xgfaw76,UZ,Tashkent,Academy of Sciences Republic of Uzbekistan,government
-0.16599335405919646,https://ror.org/00k8k8t47,UZ,Namangan,Namangan State University,education
-0.19576100963526488,https://ror.org/00qcztw05,UZ,Tashkent,Ministry of Health of the Republic of Uzbekistan,government
-0.19576100963526488,https://ror.org/02ps8wg39,UZ,Tashkent,Tashkent Institute Of Postgraduate Medical Education,healthcare
-0.23097600455755177,https://ror.org/01bmg2a15,UZ,Tashkent,Tashkent State Technical University named after Islam Karimov,education
-0.2586068823693021,https://ror.org/03d53xe41,UZ,Tashkent,Tashkent State University of Oriental Studies,education
-0.31853712261619005,https://ror.org/043dtk166,UZ,Tashkent,University of World Economy and Diplomacy,education
-0.34096340852525,https://ror.org/05gr4mx33,UZ,Tashkent,Tashkent State Agrarian University,education
-0.3576404818581098,https://ror.org/01x2s7885,UZ,Tashkent,Tashkent State University of Law,education
-0.39078085147866776,https://ror.org/051g1n833,UZ,Tashkent,Tashkent State Pedagogical University named after Nizami,education
-0.4197763023098548,https://ror.org/05awqgz82,UZ,Tashkent,Republican Specialized Scientific and Practical Medical Center of Oncology and Radiology,healthcare
-0.4197763023098548,https://ror.org/035v3tr79,UZ,Tashkent,New Uzbekistan University,education
-0.4397196124507053,https://ror.org/029t9db68,UZ,Tashkent,Tashkent State University of Economics,education
-0.4465942307803696,https://ror.org/032vgar48,UZ,Tashkent,Westminster International University in Tashkent,education
-0.6341919383414603,https://ror.org/00bad4666,UZ,Andijon,Andijan State University,education
-0.6999615333381944,https://ror.org/02b6gy972,UZ,Samarkand,Samarkand State University named after Sharof Rashidov,education
-0.7082327147174998,https://ror.org/043h9aq51,UZ,Tashkent,Tashkent Islamic University,education
-0.740405360411007,https://ror.org/00jxr5c40,UZ,Tashkent,Tashkent State Transport University,education
-0.7477360001182128,https://ror.org/01ga8zd22,UZ,Andijon,Andijan State Medical Institute,healthcare
-0.7750441804192635,https://ror.org/018mf9d35,UZ,Tashkent,Tashkent Financial Institute,education
-0.7916844077272988,https://ror.org/05987a729,UZ,Tashkent,Tashkent University of Information Technology,education
-0.8060626735224283,https://ror.org/00kb8e717,UZ,Samarkand,Samarkand branch of Tashkent State University of Economics,education
-0.8060626735224283,https://ror.org/05ap1tw43,UZ,Jizzakh,Jizzakh State Pedagogical University,education
-0.8761289703976999,https://ror.org/059w0gb06,UZ,Nukus,Karakalpak State University,education
-0.903033852258931,https://ror.org/0350qvj56,UZ,Qarshi,Karshi State University,education
-0.9137295233165891,https://ror.org/03zjy9626,UZ,Jizzax,Jizzakh Polytechnic Institute,education
-0.9167018383091665,https://ror.org/05416zy49,UZ,Tirmiz,Termez State University,education
-0.9634906650001681,https://ror.org/04q8yne12,UZ,Navoiy,Navoi State Pedagogical Institute,education
-0.9684808808413425,https://ror.org/0593kfr97,UZ,Urganch,Urgench State University,education
-0.9691098073129162,https://ror.org/0404f9j94,UZ,Guliston,Gulistan State University,education
-1.0323125032762657,https://ror.org/042xrxv40,UZ,Tashkent,Turin Polytechnic University,education
-1.0354023175891756,https://ror.org/00ste1919,UZ,Tashkent,Tashkent Pharmaceutical Institute,education
-1.074836858877268,https://ror.org/017x26m02,UZ,Tashkent,Uzbek State University of World Languages,education
-1.1159265409966719,https://ror.org/05k4xnj24,UZ,Bukhara,Bukhara State University,education
-1.1185183990250835,https://ror.org/0190ze463,UZ,Fergana,Ferghana State University,education
-1.2309368249702017,https://ror.org/00fds2k14,UZ,Fergana,Ferghana Polytechnical Institute,education
-1.2309444520984232,https://ror.org/05eze5936,UZ,Andijan,Andijan Machine-building Institute,education
-1.242132584360149,https://ror.org/0362r6n51,UZ,Qo‘qon,Kokand State Pedagogical Institute named after Mukimi,education
-1.2913914095152486,https://ror.org/03gc29549,UZ,Samarkand,"Samarkand State University of Veterinary Medicine, Livestock and Biotechnologies",education
-1.3005464770357207,https://ror.org/04xc7z697,UZ,Navoiy,Navoi State Mining Institute,education
-1.5194410157571672,https://ror.org/01b54nd92,UZ,Nukus,Nukus State Pedagogical Institute named after Ajiniyaz,education
-1.5682297197834068,https://ror.org/0483fxt86,UZ,Samarkand,Samarkand State Institute of Foreign Languages,education
-1.7751128280447412,https://ror.org/03wj83q95,UZ,Tashkent,Tashkent Automobile and Road Construction Institute,education
-2.230888640565595,https://ror.org/00megt644,UZ,Namangan,Namangan Engineering Pedagogical Institute,education
