OrgSpringRank,OrgID,OrgLocationCountry,OrgLocationDetails,OrgName,OrgType
0.875186265398088,https://ror.org/00hvbx079,IR,Tehran,School of International Relations,education
0.45246217301588865,https://ror.org/03mwgfy56,IR,Tehran,Tarbiat Modares University,education
0.42022442087338296,https://ror.org/03eykm948,IR,Bū’īn Zahrā,"Islamic Azad University, Buin-Zahra",education
0.322521809104533,https://ror.org/01a79sw46,IR,Tehran,Iran Polymer and Petrochemical Institute,education
0.29909996428497176,https://ror.org/024c2fq17,IR,Tehran,Sharif University of Technology,education
0.264665039096309,https://ror.org/03ckh6215,IR,Tehran,National Institute of Genetic Engineering and Biotechnology,facility
0.2294215602326121,https://ror.org/047yd9004,IR,Tehran,Institute for Color Science and Technology,facility
0.21146835599378339,https://ror.org/02yerkk86,IR,Orūmīyeh,Afagh Higher Education Institute,education
0.17972159708927027,https://ror.org/0108cpj15,IR,Tehran,High Institute for Education and Research in Transfusion Medicine,education
0.1270118233298954,https://ror.org/03rk5jj58,IR,Tehran,International Institute of Earthquake Engineering and Seismology,facility
0.12437353021563516,https://ror.org/05jme6y84,IR,Tehran,University of Social Welfare and Rehabilitation Sciences,education
0.12279172480031181,https://ror.org/02p3y5t84,IR,Tehran,Materials and Energy Research Center,facility
0.11998077543102457,https://ror.org/05vf56z40,IR,Tehran,University of Tehran,education
0.06219107647587227,https://ror.org/01c4pz451,IR,Tehran,Tehran University of Medical Sciences,education
0.02921768818643879,https://ror.org/04gzbav43,IR,Tehran,Amirkabir University of Technology,education
0.023944674024911898,https://ror.org/016tr2g85,IR,Tehran,Khatam University,education
0.022829959881944403,https://ror.org/020sjp894,IR,Tehran,Chemistry and Chemical Engineering Research Center of Iran,facility
0.0007361068073109877,https://ror.org/000m4se28,IR,Tehran,Aerospace Research Institute,facility
0.0,https://ror.org/011jgwj89,IR,Tehran,Iranian Academy of Medical Sciences,education
-0.009122000445367252,https://ror.org/0378cd528,IR,Tehran,Institute for Cognitive Science Studies,facility
-0.014763670195532158,https://ror.org/00bzsst90,IR,Zanjān,Institute for Advanced Studies in Basic Sciences,education
-0.022741060422928106,https://ror.org/02hyahm52,IR,Tehran,University of Judicial Sciences and Administrative Services,education
-0.027271616592916666,https://ror.org/01jw2p796,IR,Tehran,Iran University of Science and Technology,education
-0.05158820803134028,https://ror.org/02cc4gc68,IR,Tehran,Allameh Tabataba'i University,education
-0.1004133188036931,https://ror.org/0433abe34,IR,Tehran,K.N.Toosi University of Technology,education
-0.10717425330520025,https://ror.org/00wqczk30,IR,Tehran,Pasteur Institute of Iran,facility
-0.1492958188856488,https://ror.org/03w04rv71,IR,Tehran,Iran University of Medical Sciences,education
-0.1554862029241385,https://ror.org/044tdw637,IR,Qom,Mofid University,education
-0.16645993022989086,https://ror.org/0091vmj44,IR,Tehran,Shahid Beheshti University,education
-0.17140731873214268,https://ror.org/03aqgee13,IR,Isfahan,Isfahan University of Art,education
-0.21177252480235143,https://ror.org/0043ezw98,IR,Tehran,Malek Ashtar University of Technology,education
-0.21470681651560672,https://ror.org/00kj4zk54,IR,Tabriz,Tabriz Islamic Arts University,education
-0.2286648793962016,https://ror.org/04sfka033,IR,Mashhad,Mashhad University of Medical Sciences,education
-0.27339088808849843,https://ror.org/01ysgtb61,IR,Tehran,Baqiyatallah University of Medical Sciences,education
-0.2741629654424383,https://ror.org/034m2b326,IR,Tehran,Shahid Beheshti University of Medical Sciences,education
-0.2911498881482477,https://ror.org/04esb6v42,IR,Tehran,Imam Hossein University,education
-0.31576816867692414,https://ror.org/02ggnbj54,IR,Tehran,Tehran University of Art,education
-0.32850152652727554,https://ror.org/017zx9g19,IR,Tehran,Iranian Research Organization for Science and Technology,facility
-0.329896609885621,https://ror.org/05hsgex59,IR,Tehran,Kharazmi University,education
-0.3333031738137522,https://ror.org/01e8ff003,IR,Tehran,Shahed University,education
-0.3353876318443168,https://ror.org/0284vkq26,IR,Sari,Sari Agricultural Sciences and Natural Resources University,education
-0.3406806167566358,https://ror.org/0451xdy64,IR,Kerman,Graduate University of Advanced Technology,education
-0.34980679643306034,https://ror.org/02j3xat32,IR,Tehran,National Iranian Oil Company (Iran),company
-0.35104813621062236,https://ror.org/028qtbk54,IR,Shiraz,Shiraz University,education
-0.36431434257152445,https://ror.org/03xtc7g80,IR,Tehran,Industrial Management Institute,education
-0.3653413345997545,https://ror.org/04bxa3v83,IR,Shiraz,Shiraz University of Technology,education
-0.3737923095406482,https://ror.org/0506tgm76,IR,Shahr-e Kord,Shahrekord University of Medical Sciences,education
-0.3833455955853804,https://ror.org/02kxbqc24,IR,Kerman,Kerman University of Medical Sciences,education
-0.4013140579289943,https://ror.org/01rws6r75,IR,Ahvaz,Ahvaz Jundishapur University of Medical Sciences,education
-0.40799944109916536,https://ror.org/01w6vdf77,IR,Gorgān,Gorgan University of Agricultural Sciences and Natural Resources,education
-0.41299387660742715,https://ror.org/013cdqc34,IR,Tehran,Alzahra University,education
-0.41839197997477956,https://ror.org/048e0p659,IR,Tehran,University of Science and Culture,education
-0.4239781026497855,https://ror.org/04waqzz56,IR,Isfahan,Isfahan University of Medical Sciences,education
-0.4387325518059488,https://ror.org/04krpx645,IR,Tabriz,Tabriz University of Medical Sciences,education
-0.44514844467463266,https://ror.org/03wdrmh81,IR,Tabriz,Sahand University of Technology,education
-0.46124235726192647,https://ror.org/05h9t7759,IR,Isfahan,University of Isfahan,education
-0.4652164882560247,https://ror.org/00yqvtm78,IR,Shahrud,University of Shahrood,education
-0.4704440138127353,https://ror.org/00af3sa43,IR,Isfahan,Isfahan University of Technology,education
-0.485970033350825,https://ror.org/00g6ka752,IR,Mashhad,Ferdowsi University of Mashhad,education
-0.4980524534921134,https://ror.org/02r5cmz65,IR,Bābol,Babol University of Medical Sciences,education
-0.5187090414308981,https://ror.org/02jeykk09,IR,Qazvin,Imam Khomeini International University,education
-0.5381692788960609,https://ror.org/029gksw03,IR,Semnan,Semnan University,education
-0.545871930593965,https://ror.org/0066jc902,IR,Tehran,Soil Conservation and Watershed Management Research,facility
-0.545871930593965,https://ror.org/01kpm1136,IR,Tehran,Research Institute for Endocrine Sciences,facility
-0.5811777853443776,https://ror.org/01kzn7k21,IR,Tehran,"Islamic Azad University, Tehran",education
-0.5848909121196897,https://ror.org/03d9mz263,IR,Zabol,Zabol University,education
-0.5970359000215397,https://ror.org/01n3s4692,IR,Shiraz,Shiraz University of Medical Sciences,education
-0.6015968974763122,https://ror.org/0126z4b94,IR,Tehran,"Academic Center for Education, Culture and Research",nonprofit
-0.6088042786507507,https://ror.org/02wkcrp04,IR,Sari,Mazandaran University of Medical Sciences,education
-0.6094450434638263,https://ror.org/03mcx2558,IR,Gorgān,Golestan University of Medical Sciences,education
-0.6163298909358157,https://ror.org/01k3mbs15,IR,Ahvaz,Shahid Chamran University of Ahvaz,education
-0.6213265626125752,https://ror.org/05vspf741,IR,Kermanshah,Kermanshah University of Medical Sciences,education
-0.634096381634578,https://ror.org/00r0xhf81,IR,Tehran,Petroleum University of Technology,education
-0.6359557869895731,https://ror.org/02mkkqv65,IR,Tehran,Imam Sadiq University,education
-0.6395707216035983,https://ror.org/02zc85170,IR,Bābol,Babol Noshirvani University of Technology,education
-0.6409618754645828,https://ror.org/02ekfbp48,IR,Hamadan,Hamedan University of Medical Sciences,education
-0.6517135963344002,https://ror.org/01papkj44,IR,Tabriz,University of Tabriz,education
-0.6580656606551905,https://ror.org/02aq81f26,IR,Tehran,Power and Water University of Technology,education
-0.661441495066348,https://ror.org/04zn42r77,IR,Kerman,Shahid Bahonar University of Kerman,education
-0.6632658155559484,https://ror.org/042hptv04,IR,Īlām,Medical University of Ilam,education
-0.6644161283059179,https://ror.org/00fafvp33,IR,Gonābād,Gonabad University of Medical Sciences,education
-0.6740115840243525,https://ror.org/01ntx4j68,IR,Sanandij,Kurdistan University of Medical Sciences,education
-0.6822348334423126,https://ror.org/03r42d171,IR,Zahedan,Zahedan University of Medical Sciences,education
-0.6894361082381719,https://ror.org/04ka8rx28,IR,Hamadan,Bu-Ali Sina University,education
-0.6943303687304042,https://ror.org/05tgdvt16,IR,Sabzawār,Sabzevar University of Medical Sciences,education
-0.6947105393619066,https://ror.org/02x99ac45,IR,Yazd,Yazd University,education
-0.6992455656875907,https://ror.org/004v5tb85,IR,Tehran,"Ministry of Science, Research and Technology",government
-0.6997958675555258,https://ror.org/01xf7jb19,IR,Zanjān,Zanjan University of Medical Sciences,education
-0.7227802753444954,https://ror.org/03hh69c20,IR,Karaj,Alborz University of Medical Sciences,education
-0.7258340062983281,https://ror.org/048wxdk46,IR,Khorramshahr,Khorramshahr University of Marine Science and Technology,education
-0.7295376694325708,https://ror.org/042jrxd70,IR,Chabahar,International University of Chabahar,education
-0.7324667150364882,https://ror.org/0132f0t75,IR,Tehran,Sarem Cell Research Center,facility
-0.7407358455957062,https://ror.org/03dc0dy65,IR,Kāshān,Kashan University of Medical Sciences,education
-0.7478945844795826,https://ror.org/02nkz4493,IR,Tehran,Shahid Rajaee Teacher Training University,education
-0.7580053105289575,https://ror.org/05y44as61,IR,Semnan,Semnan University of Medical Sciences,education
-0.7639819582639694,https://ror.org/011xesh37,IR,Karaj,Razi Vaccine and Serum Research Institute,company
-0.7670466179363152,https://ror.org/05fp9g671,IR,Bābolsar,University of Mazandaran,education
-0.7793567695670018,https://ror.org/01bdr6121,IR,Rasht,University of Guilan,education
-0.7899726384946478,https://ror.org/032fk0x53,IR,Orūmīyeh,Urmia University,education
-0.7910999249894726,https://ror.org/03jbsdf87,IR,Urmia,Urmia University of Medical Sciences,education
-0.7944106474756492,https://ror.org/02p5wzp69,IR,Tehran,Iran Broadcasting University,education
-0.8045294298145264,https://ror.org/03s3hf581,IR,Babol,Mazandaran University of Science and Technology,education
-0.8051780107591704,https://ror.org/015zmr509,IR,Kāshān,University of Kashan,education
-0.8092987831698263,https://ror.org/01rs0ht88,IR,Tehran,Ministry of Health and Medical Education,government
-0.810615885461267,https://ror.org/023crty50,IR,Shahrud,Shahroud University of Medical Sciences,education
-0.8191794387069642,https://ror.org/037k29e77,IR,Tehran,Iranian National Institute for Oceanography and Atmospheric Science,facility
-0.8206146010335716,https://ror.org/02ynb0474,IR,Kermanshah,Razi University,education
-0.8353433352214882,https://ror.org/0436hqh35,IR,Tehran,MAPNA Group (Iran),company
-0.842451301487205,https://ror.org/03n2mgj60,IR,Bandar Būshehr,Persian Gulf University,education
-0.8554926221606536,https://ror.org/03ddeer04,IR,Qom,University of Qom,education
-0.8555245990599722,https://ror.org/045zrcm98,IR,Ardabīl,University of Mohaghegh Ardabili,education
-0.8619152592781859,https://ror.org/05e34ej29,IR,Zanjān,University of Zanjan,education
-0.8654921516436443,https://ror.org/053wftt74,IR,Tehran,Arak University of Technology,education
-0.8670552386270105,https://ror.org/02v319z25,IR,Orūmīyeh,Urmia University of Technology,education
-0.8677643108531262,https://ror.org/01s8nf094,IR,Qom,University of Religions and Denominations,education
-0.8684205582588816,https://ror.org/04zepk655,IR,Qom,Qom University of Technology,education
-0.8701339661781718,https://ror.org/05pg2cw06,IR,Tabriz,Azarbaijan Shahid Madani University,education
-0.8813180964690739,https://ror.org/02y18ts25,IR,Bandar Būshehr,Bushehr University of Medical Sciences,education
-0.9028914254687702,https://ror.org/04feqxb79,IR,Tehran,Atomic Energy Organization of Iran,government
-0.9057631996154293,https://ror.org/051bats05,IR,Khorramabad,Lorestan University,education
-0.9194981871549276,https://ror.org/02fgvvg92,IR,Tehran,National Nutrition and Food Technology Research Institute,other
-0.9203303228872205,https://ror.org/00ngrq502,IR,Arāk,Arak University,education
-0.9267495907594259,https://ror.org/003jjq839,IR,Bandar Abbas,Hormozgan University,education
-0.9268559249129268,https://ror.org/04xreqs31,IR,Tehran,Institute for Research in Fundamental Sciences,facility
-0.9340004602356146,https://ror.org/02n43xw86,IR,Zahedan,University of Sistan and Baluchestan,education
-0.9351951262014185,https://ror.org/046nf9z89,IR,Gorgān,Golestan University,education
-0.9354828856424238,https://ror.org/031699d98,IR,Tehran,Payame Noor University,education
-0.936059308298994,https://ror.org/01jqdqz10,IR,Tehran,Sina Hospital,healthcare
-0.9409337429316632,https://ror.org/04k89yk85,IR,Sanandij,University of Kurdistan,education
-0.940964125767818,https://ror.org/05m22kb23,IR,Rasht,University of Gilan,education
-0.9412882294514675,https://ror.org/01h2hg078,IR,Bīrjand,Birjand University of Medical Sciences,education
-0.9438839013581317,https://ror.org/01r4svf88,IR,Tehran,Sadra Institute Of Higher Education,education
-0.9489797751237002,https://ror.org/03v4m1x12,IR,Dāmghān,Damghan University,education
-0.9617853933766991,https://ror.org/04jf6jw55,IR,Behshahr,University of Science and Technology of Mazandaran,education
-0.9649696476836068,https://ror.org/0037djy87,IR,Marāgheh,University of Maragheh,education
-0.9710525006937455,https://ror.org/01zby9g91,IR,Yazd,Shahid Sadoughi University of Medical Sciences and Health Services,education
-0.9816619684697989,https://ror.org/05d09wf68,IR,Karaj,Agricultural Biotechnology Research Institute of Iran,facility
-0.9822526295226213,https://ror.org/015w62071,IR,Tehran,Iran Khodro (Iran),company
-0.9835139959772382,https://ror.org/01v8x0f60,IR,Rafsanjān,Rafsanjan University of Medical Sciences,education
-0.9842196165376023,https://ror.org/032fhk095,IR,Karaj,Karaj Payam Noor University,education
-0.9849025492234361,https://ror.org/01r1kqm06,IR,Ahvaz,Ramin Agriculture and Natural Resources University of Khouzestan,education
-0.9889432743376753,https://ror.org/01r277z15,IR,Īlām,Ilam University,education
-0.9894916548596817,https://ror.org/00kt3gv27,IR,Meymeh,NourDanesh Institute of Higher Education,education
-0.9910254514058606,https://ror.org/051rngw70,IR,Shahr-e Kord,Shahrekord University,education
-0.9931285714034918,https://ror.org/05xf50770,IR,Tehran,Niroo Research Institute,facility
-1.0036182112923417,https://ror.org/035t7rn63,IR,Khorramabad,Lorestan University of Medical Sciences,education
-1.0103362109047591,https://ror.org/04gc62a64,IR,Garmsār,University of Garmsar,education
-1.0172579546741534,https://ror.org/00mbysk96,IR,Qom,Al-Mustafa International University,education
-1.0195185955637487,https://ror.org/00rs50b76,IR,Chabahar,Chabahar Maritime University,education
-1.021986831574961,https://ror.org/00zyh6d22,IR,Sabzevar,Hakim Sabzevari University,education
-1.0372782839614727,https://ror.org/01hgb6e08,IR,Hamadān,Hamedan University of Technology,education
-1.0376850692109365,https://ror.org/05khxfe53,IR,Bojnūrd,University of Bojnord,education
-1.0391779292062215,https://ror.org/040f6ar92,IR,Tafresh,Tafresh University,education
-1.0404656044717104,https://ror.org/04n4dcv16,IR,Ardabīl,Ardabil University of Medical Sciences,education
-1.049588379609555,https://ror.org/01n71v551,IR,Tehran,Universal Scientific Education and Research Network,nonprofit
-1.0508842269196688,https://ror.org/056xnk046,IR,Rafsanjān,Vali Asr University of Rafsanjan,education
-1.0547748639526482,https://ror.org/019f08v97,IR,Dezful,Jundi-Shapur University of Technology,education
-1.0557747119664374,https://ror.org/050rnbb37,IR,Āmol,Shomal University,education
-1.0607596864866125,https://ror.org/05629dh87,IR,Tehran,Iran's National Elites Foundation,government
-1.0630020260486794,https://ror.org/04a1nf004,IR,Gonbad-e Kāvūs,Gonbad Kavous University,education
-1.0749324955642174,https://ror.org/0536t7y80,IR,Bojnūrd,North Khorasan University of Medical Sciences,education
-1.0754179990650155,https://ror.org/05sy5hm57,IR,Yasuj,Yasouj University,education
-1.076587456110461,https://ror.org/00y2dy597,IR,Qom,Qom University of Medical Science and Health Services,education
-1.0812675501711546,https://ror.org/037wqsr57,IR,Bandar Abbas,Hormozgan University of Medical Sciences,education
-1.0845988067186105,https://ror.org/01qpg5w50,IR,Mashhad,Tabaran Institute of Higher Education,education
-1.0872402136686423,https://ror.org/056mgfb42,IR,Arak,Arak University of Medical Sciences,education
-1.0882777162173316,https://ror.org/032hv6w38,IR,Tehran,Agricultural Research & Education Organization,nonprofit
-1.0945088658180773,https://ror.org/00mz6ad23,IR,Jīroft,University of Jiroft,education
-1.1018943488026667,https://ror.org/03g4hym73,IR,Bīrjand,University of Birjand,education
-1.1155806392261365,https://ror.org/01a3g2z22,IR,Tehran,Iran Telecommunication Research Center,facility
-1.1217936878718644,https://ror.org/00kp9ef37,IR,Tehran,Shahid Sattari University of Aeronautical Engineering,education
-1.1235394030982104,https://ror.org/007jfm765,IR,Mashhad,Imam Reza International University,education
-1.1277563307866194,https://ror.org/03rk9sq81,IR,Malāyer,Malayer University,education
-1.1310428226887264,https://ror.org/02nee2y72,IR,Bū’īn Zahrā,Buein Zahra Technical University,education
-1.1460087272148778,https://ror.org/00y611a79,IR,Shiraz,Shiraz University of Arts,education
-1.1579500372851506,https://ror.org/01eqwx273,IR,Qom,Hazrat-e Masoumeh University,education
-1.1610040746067651,https://ror.org/02e9szc72,IR,Qom,Shahab Danesh University,education
-1.1707546740590458,https://ror.org/028dyak29,IR,Tehran,Aja University of Medical Sciences,education
-1.1747090563750842,https://ror.org/03r7vnf29,IR,Isfahan,Golpayegan University of Engineering,education
-1.1819538418758622,https://ror.org/04bad2882,IR,Tehran,Civil Aviation Technology College,education
-1.1913309898555287,https://ror.org/04b9hej41,IR,Mashhad,Sadjad University of Technology,education
-1.1967900492444046,https://ror.org/0377qcz53,IR,Borūjerd,Ayatollah Boroujerdi University,education
-1.2198123215450667,https://ror.org/02fvps960,IR,Tehran,Farabi Eye Hospital,healthcare
-1.2212353910233804,https://ror.org/037s33w94,IR,Yasuj,Yasuj University of Medical Sciences,education
-1.225357440624519,https://ror.org/04kpdmm83,IR,Ardakān,Ardakan University,education
-1.2300996143865806,https://ror.org/02bykax26,IR,Tehran,Geological Survey of Iran,other
-1.242402001036807,https://ror.org/0161hbt42,IR,Gonābād,University of Gonabad,education
-1.272388959923276,https://ror.org/0324c8f61,IR,Tehran,Mahak Hospital and Rehabilitation Complex,healthcare
-1.2843428960249172,https://ror.org/023tdry64,IR,Sirjan,Sirjan University of Technology,education
-1.3058339653339435,https://ror.org/01rb4vv49,IR,Tehran,Shariati Hospital,healthcare
-1.3060395647109362,https://ror.org/01bt5mj78,IR,Qūchān,Quchan University of Advanced Technology,education
-1.3075418898391782,https://ror.org/04r58gt57,IR,Tehran,University of Applied Science and Technology,education
-1.3194949089177765,https://ror.org/044enjr66,IR,Mashhad,Eqbal Lahoori Institute of Higher Education,education
-1.3222439427273855,https://ror.org/05d627n32,IR,Tehran,Research Institute of Forests and Rangelands,government
-1.3388765493249732,https://ror.org/01hw7wf62,IR,Tehran,Ministry of Education,government
-1.3418785936196531,https://ror.org/04bz0e642,IR,Isfahan,Sheikh Bahaei University,education
-1.350141687738496,https://ror.org/037tr0b92,IR,Zabol,Zabol University of Medical Sciences,education
-1.3540083578048987,https://ror.org/00bqttt79,IR,Marvdasht,"Islamic Azad University, Marvdasht",education
-1.3620540879304655,https://ror.org/01app8660,IR,Bonāb,University of Bonab,education
-1.364799690296517,https://ror.org/01yxvpn13,IR,Jahrom,Jahrom University of Medical Sciences,healthcare
-1.3719567030154294,https://ror.org/05hkxne09,IR,Kermanshah,Kermanshah University of Technology,education
-1.3730837393655573,https://ror.org/03ezqnp95,IR,Torbat-e Ḩeydarīyeh,Torbat Heydarieh University of Medical Sciences,education
-1.3733199680730042,https://ror.org/01t0d1m90,IR,Tehran,Iran Banking Institute,education
-1.3784875306475592,https://ror.org/02kqbjv38,IR,Tabriz,University College of Nabi Akram,education
-1.381831509832544,https://ror.org/05tbrga38,IR,Tehran,Iranian Research Institute of Plant Protection,facility
-1.3828489063356804,https://ror.org/02mm76478,IR,Bam,Bam University of Medical Sciences,education
-1.3866876419638496,https://ror.org/02twggb97,IR,Āmol,Amol University of Special Modern Technologies,education
-1.4008404555053868,https://ror.org/00854zy02,IR,Tehran,Technical and Vocational University,education
-1.4180119532707895,https://ror.org/00ccnfj96,IR,Shiraz,Regional Information Center for Science and Technology,government
-1.4270287991456068,https://ror.org/01rvhet58,IR,Tabriz,Farhangian University,education
-1.436620443208107,https://ror.org/03sr1ma14,IR,Tehran,Iran National Science Foundation,facility
-1.4382788554656085,https://ror.org/054zftm42,IR,Tehran,Shaheed Rajaei Cardiovascular Medical and Research Center,healthcare
-1.4502517696658321,https://ror.org/04v0mdj41,IR,Sāveh,Saveh University of Medical Sciences,education
-1.4596370976697646,https://ror.org/02psd3416,IR,Chālūs,"Islamic Azad University, Nowshahr Branch",education
-1.4601503971380814,https://ror.org/03xp8p672,IR,Jahrom,Jahrom University,education
-1.4894631533935958,https://ror.org/05bh0zx16,IR,Fasā,Fasa University of Medical Sciences,education
-1.5206394541277624,https://ror.org/01x41eb05,IR,Neyshābūr,University of Neyshabur,education
-1.5418997017027127,https://ror.org/05dsae220,IR,Mashhad,Khayyam University,education
-1.5503619935791342,https://ror.org/033hgcp80,IR,Dezful,Dezful University of Medical Sciences,education
-1.5696109923629022,https://ror.org/053p3yv46,IR,Iranshahr,Salman Farsi University of Kazerun,education
-1.5794151006711348,https://ror.org/01sa5tb56,IR,Aliabad-e Katul,"Islamic Azad University, Aliabad Katoul",education
-1.5794151006711348,https://ror.org/03gdq6t30,IR,Tehran,Iran National Standards Organization,government
-1.5794151006711348,https://ror.org/03jayhg97,IR,Tehran,Milad Hospital,healthcare
-1.5794151006711348,https://ror.org/04dacya36,IR,Tehran,Renewable Energy and Energy Efficiency Organization,government
-1.5794151006711348,https://ror.org/04ppdmy96,IR,Chālūs,Tabarestan University,education
-1.6136470838290944,https://ror.org/02x44xg10,IR,Isfahan,Ragheb Esfahani Institute,education
-1.6335746072593775,https://ror.org/01s5r7k60,IR,Mashhad,Razavi University of Islamic Sciences,education
-1.638539633457975,https://ror.org/03ncps145,IR,Torbat-e Ḩeydarīyeh,University of Torbat Heydarieh,education
-1.659716490774663,https://ror.org/00d4h7g98,IR,Marāgheh,Research Institute for Astronomy and Astrophysics of Maragh,facility
-1.741840862711073,https://ror.org/01e7e7r31,IR,Bojnourd,Kosar University of Bojnord,education
-1.7834695244893057,https://ror.org/04r8tna72,IR,Sari,Hadaf Institute of Higher Education,education
-1.7881711655507264,https://ror.org/01c0kpp64,IR,Orūmīyeh,University College of Azarabadegan,education
-1.7881711655507264,https://ror.org/047ae9605,IR,Tehran,Taleghani General Hospital,healthcare
-2.2119666990091895,https://ror.org/00eqgy272,IR,Nūr,Allameh Mohaddes Nouri University,education
